[
  {
    "id": "brewer_1989_retrospective",
    "title": "HISTORY OF THE APPLICATION OF THE GENERALIZED LEWIS ACID-BASE THEORY TO METALS",
    "authors": [
      "Leo Brewer"
    ],
    "year": 1989,
    "publication": "Lawrence Berkeley Laboratory",
    "file": "data\\brewer.txt",
    "doi": "10.1016/0022-3115(89)90418-2"
  }
]
