[
  {
    "id": "rijkers_2024",
    "title": "Oswald Avery: Pioneer of Bacterial Vaccines and the First to Discover the Function of DNA",
    "authors": [
      "Ger Rijkers",
      "Karen Dekker",
      "Guy Berbers"
    ],
    "year": 2024,
    "publication": "Cureus",
    "doi": "10.7759/cureus.71465",
    "url": "https://doi.org/10.7759/cureus.71465",
    "file": "data\\avery.txt"
  }
]
