[
  {
    "id": "matic_2021",
    "title": "Pierre-Joseph Desault, 1744-1795",
    "authors": [
      "Slađana Matić",
      "Dragana Vučković",
      "Ivana Glišović-Jovanović",
      "Stefan Korica",
      "Marko Simić",
      "Katarina Gambiroža",
      "Mihailo Ille"
    ],
    "year": 2021,
    "publication": "History of medicine",
    "file": "data\\desault.txt",
    "doi": "10.5937/tmg2103141m"
  }
]
