[
  {
    "id": "steffen_2014",
    "title": "From San Francisco to Tōhoku – 111 yr of continuous earthquake recording in Göttingen",
    "authors": [
      "H. Steffen",
      "W. Brunk",
      "M. Leven",
      "U. Wedeken"
    ],
    "year": 2014,
    "publication": "Hist. Geo Space Sci.",
    "url": "www.hist-geo-space-sci.net/5/1/2014/",
    "file": "data\\e_wiechert.txt",
    "doi": "10.5194/hgss-5-1-2014"
  }
]
