[
  {
    "id": "pridan_virchow_social_medicine",
    "title": "Rudolf Virchow and Social Medicine in Historical Perspective",
    "authors": [
      "Daniel Pridan"
    ],
    "publication": "Cambridge Core",
    "doi": "10.1017/s002572730002963x",
    "url": "https://www.cambridge.org/core/terms",
    "file": "data\\virchow.txt",
    "year": 1964
  }
]
