[
  {
    "id": "zweig_2010_memories",
    "title": "Memories of Murray and the Quark Model",
    "authors": [
      "George Zweig"
    ],
    "year": 2010,
    "publication": "Conference in Honor of Murray Gell-Mann's 80th Birthday",
    "url": "https://arxiv.org/abs/1007.0494",
    "file": "data\\m_gellmann.txt",
    "doi": "10.1142/s0217751x10050494"
  }
]
