[
  {
    "id": "yazaki_2017",
    "title": "How the Klein –Nishina formula was derived: Based on the Sangokan Nishina Source Materials",
    "authors": [
      "Yuji Yazaki"
    ],
    "year": 2017,
    "publication": "Proc. Jpn. Acad., Ser. B",
    "doi": "10.2183/pjab.93.025",
    "file": "data\\nishina.txt"
  }
]
