[
  {
    "id": "kaouache_2024",
    "title": "Edward Calvin Kendall: A Pioneer in Biochemistry and Endocrinology",
    "authors": [
      "Nadjib Kaouache",
      "Nassim Nouri"
    ],
    "year": 2024,
    "publication": "Cureus",
    "doi": "10.7759/cureus.69420",
    "file": "data\\kendall.txt"
  }
]
