[
  {
    "id": "ihde_reinhold_2017",
    "title": "Friedrich Robert Helmert, founder of modern geodesy, on the occasion of the centenary of his death",
    "authors": [
      "Johannes Ihde",
      "Andreas Reinhold"
    ],
    "year": 2017,
    "publication": "Hist. Geo Space Sci.",
    "doi": "10.5194/hgss-8-79-2017",
    "url": "https://doi.org/10.5194/hgss-8-79-2017",
    "file": "data\\helmert.txt"
  }
]
