[
  {
    "id": "gibson_1970_bio_medical_pursuits",
    "title": "The Bio-medical Pursuits of Christopher Wren",
    "authors": [
      "William Carleton Gibson"
    ],
    "year": 1970,
    "publication": "Medical History",
    "file": "data\\wren.txt",
    "doi": "10.1017/s0025727300015787",
    "url": "https://doi.org/10.1017/S0025727300015787"
  }
]
