[
  {
    "id": "lahav_2019",
    "title": "Jacob Bekenstein's Universes: From Black Holes to Modiﬁed Theories of Gravity",
    "authors": [
      "Ofer Lahav"
    ],
    "year": 2019,
    "publication": "arXiv:1912.11140v1",
    "url": "https://arxiv.org/abs/1912.11140",
    "file": "data\\bekenstein.txt",
    "doi": "10.1142/11373"
  }
]
