[
  {
    "id": "gordon_1978",
    "title": "Williamina Fleming: \"Women's Work\" at the Harvard Observatory",
    "authors": [
      "Anne Gordon"
    ],
    "year": 1978,
    "publication": "Women's Studies Quarterly Archives and Special Collections",
    "url": "https://academicworks.cuny.edu/wsq/268",
    "file": "data\\fleming.txt"
  }
]
