[
  {
    "id": "saxena_bhalla_2020",
    "title": "100th Anniversary of the discovery of Ferroelectricity: How did it impact the Current Day Physics",
    "authors": [
      "Saxena, Avadh Behari",
      "Bhalla, Amar S."
    ],
    "year": 2020,
    "publication": "arXiv",
    "file": "data\\valasek.txt",
    "doi": "10.2172/1633563"
  }
]
