[
  {
    "id": "metchnikoff_bio_2016",
    "title": "Nobel laureate il ya i. me tchNi koff (1845-1916). li fe story a Nd s cieNt ific heritage",
    "authors": [
      "Yu. V. EzEp chU K",
      "D. V. KolY Bo"
    ],
    "year": 2016,
    "publication": "Ukr. Biochem. J.",
    "doi": "10.15407/ubj88.06.098",
    "file": "data\\metchnikoff.txt"
  }
]
