[
  {
    "id": "santos_2022",
    "title": "Emil du Bois-Reymond and Dom Pedro II: Research development on bioelectricity and electric fish",
    "authors": [
      "Roberto Pereira Santos",
      "Antonio Egídio Nardi",
      "Marleide da Mota Gomes"
    ],
    "year": 2022,
    "publication": "Frontiers in Physiology",
    "doi": "10.3389/fphys.2022.985473",
    "url": "https://doi.org/10.3389/fphys.2022.985473",
    "file": "data\\reymond.txt"
  }
]
