[
  {
    "id": "nath_reminiscences_2015",
    "title": "Reminiscences of my work with Richard Lewis Arnowitt",
    "authors": [
      "Pran Nath"
    ],
    "year": 2015,
    "publication": "arXiv:1502.00639v1",
    "url": "https://arxiv.org/abs/1502.00639",
    "file": "data\\arnowitt.txt",
    "doi": "10.1088/0031-8949/90/6/068007"
  }
]
