[
  {
    "id": "berke_2009_chimia",
    "title": "Old and New 'Anschauungen in der Anorganischen Chemie'. A homage to Alfred Werner's book and intuition: Part I. Alfred Werner's book and coordination theory",
    "authors": [
      "H. Berke"
    ],
    "year": 2009,
    "publication": "CHIMIA International Journal for Chemistry",
    "doi": "10.2533/chimia.2009.541",
    "file": "data\\werner.txt"
  }
]
