[
  {
    "id": "kahn_roth_2004",
    "title": "Berson, Yalow, and the JCI: the agony and the ecstasy",
    "authors": [
      "C. Ronald Kahn",
      "Jesse Roth"
    ],
    "year": 2004,
    "publication": "The Journal of Clinical Investigation",
    "file": "data\\berson.txt",
    "doi": "10.1172/jci200423316"
  }
]
