[
  {
    "id": "cornell_memorial",
    "title": "Cornell University Faculty Memorial Statement",
    "authors": [
      "Louis J. Billera",
      "William F. Lucas",
      "Robert E. Bechhofer"
    ],
    "year": 1976,
    "publication": "Cornell University",
    "url": "http://ecommons.library.cornell.edu/handle/1813/17813",
    "file": "data\\fulkerson.txt"
  }
]
