[
  {
    "id": "hunter_2009",
    "title": "Gertrude Cox in Egypt: A Case Study in Science Patronage and International Statistics Education during the Cold War",
    "authors": [
      "Patti W. Hunter"
    ],
    "year": 2009,
    "publication": "Science in Context",
    "file": "data\\cochran.txt",
    "doi": "10.1017/s026988970800207x"
  }
]
