[
  {
    "id": "flugge_lotz_flugge_1973",
    "title": "Ludwig Prandtl in the Nineteen-Thirties: Reminiscences",
    "authors": [
      "Irmgard Fliigge-Lotz",
      "Wilhelm Fliigge"
    ],
    "year": 1973,
    "publication": "Annual Reviews",
    "file": "data\\prandtl.txt",
    "doi": "10.1146/annurev.fl.05.010173.000245"
  }
]
