[
  {
    "id": "okui_2024",
    "title": "Shibasaburo Kitasato (1853-1931): Pioneer of Japanese Medicine and Global Immunology Innovator",
    "authors": [
      "Nobuo Okui"
    ],
    "year": 2024,
    "publication": "Cureus",
    "doi": "10.7759/cureus.68276",
    "file": "data\\kitasato.txt"
  }
]
