[
  {
    "id": "puurunen_2014_short_history_ald",
    "title": "A Short History of Atomic Layer Deposition: Tuomo Suntola's Atomic Layer Epitaxy",
    "authors": [
      "Riikka L. Puurunen"
    ],
    "year": 2014,
    "publication": "Chemical Vapor Deposition, vol. 20, pp. 332–344",
    "doi": "10.1002/cvde.201402012",
    "url": "https://onlinelibrary.wiley.com/doi/10.1002/cvde.201402012",
    "file": "data\\Puurunen2014 - Tuomo Suntola.pdf"
  }
]
